日付,本文,いいね,インプレッション,タイトル
2026-01-25T18:00:00.000+09:00,日曜夜にやってはいけないこと、やるべきこと↓,0,0,「明日から」卒業
2026-01-29T06:00:00.000+09:00,運動ゼロで痩せる！？日常の「姿勢改善」ポイント↓,0,0,姿勢の意識
2026-01-28T06:00:00.000+09:00,週の半ば、ダイエットのやる気が落ちた時の対策↓,0,0,水曜の中だるみ
2026-01-26T12:00:00.000+09:00,コンビニの「痩せるおにぎり」ランキングと食べ方↓,0,0,おにぎりの選び方
2026-01-27T12:00:00.000+09:00,ダイエット効果を最大化する「コーヒー」の飲み方↓,0,0,コーヒーの飲み方
2026-01-27T06:00:00.000+09:00,毎朝スッキリ出すための「腸活」モーニング↓,0,0,便秘解消習慣
2026-01-29T18:00:00.000+09:00,ダイエット中でもお酒を楽しみたい！太らない飲み方ルール↓,0,0,お酒との付き合い方
2026-01-31T12:00:00.000+09:00,1ヶ月で4キロ痩せた土曜ランチの選び方↓,0,0,ランチの選び方
2026-01-31T06:00:00.000+09:00,1ヶ月で4キロ痩せた週末の作り置き習慣↓,0,0,週末の作り置き習慣
2026-01-27T18:00:00.000+09:00,夜の「ニセ空腹」に負けない5つの対処法↓,0,0,空腹対策
2026-01-30T06:00:00.000+09:00,魔の金曜日！ダイエットを崩壊させない5つの防壁↓,0,0,金曜の乗り切り方
2026-01-28T18:00:00.000+09:00,自炊ゼロ！スーパーのお惣菜で痩せるメニュー選び↓,0,0,自炊しない日
2026-01-25T06:00:00.000+09:00,1ヶ月で4キロ痩せた休日の朝の過ごし方↓,0,0,休日の朝習慣
2026-01-30T12:00:00.000+09:00,飽きない！サラダチキンの無限アレンジレシピ↓,0,0,サラダチキンアレンジ
2026-01-24T18:00:00.000+09:00,1ヶ月で4キロ痩せた外食メニューの選び方↓,0,0,外食の選び方
2026-01-31T18:00:00.000+09:00,1ヶ月で4キロ痩せた月末の振り返り習慣↓,0,0,1月の振り返り
2026-01-26T06:00:00.000+09:00,食べすぎた週末を「無かったこと」にするリセット術↓,0,0,月曜リセット
2026-01-28T12:00:00.000+09:00,コンビニで買える「太らないおやつ」BEST5↓,0,0,太らないおやつ
2026-01-24T12:00:00.000+09:00,1ヶ月で4キロ痩せた麺料理の楽しみ方↓,0,0,投稿案: 痩せる麺ランチ
2026-01-26T18:00:00.000+09:00,1ヶ月で4キロ痩せた「痩せるお風呂」の入り方↓,0,0,お風呂の入り方
2026-01-30T18:00:00.000+09:00,週末恒例！自分を褒めて伸ばす振り返りワーク↓,0,0,1週間の振り返り
2026-01-29T12:00:00.000+09:00,うどんより蕎麦！ランチで痩せる麺の選び方↓,0,0,蕎麦の活用法
2026-01-25T12:00:00.000+09:00,1ヶ月で4キロ痩せた日曜日の「痩せる作り置き」↓,0,0,作り置きの極意
